Sender	Receiver	Send_time	Subject	Content		
johndoe@example.com	sarah.wilson@example.com	2024-08-13 	Meeting Reminder: Project Update	Hi Sarah, Please find the latest project update attached. Let me know if you have any questions. Best, John		
janedoe@example.com	david.taylor@example.com	2024-08-14 	Invoice #10234 Attached	Dear David, Your invoice for this month is attached. Please review and let me know if there are any discrepancies. Thank you, Accounts Team		
alex.smith@example.com	olivia.martin@example.com	2024-08-15 	Upcoming Webinar: How to Boost Productivity	Hello, Don't forget to register for our upcoming webinar on productivity hacks. It's going to be a great session! Cheers, Webinar Team		
emily.jones@example.com	daniel.thomas@example.com	2024-08-16 	Team Lunch This Friday	Hi Daniel, Let's gather for a team lunch this Friday at 12 PM. Please RSVP so we can make a reservation. Best, Emialy		
michael.brown@example.com	emma.lee@example.com	2024-08-17 	Feedback on the Latest Design	Hi Emma, I’ve reviewed the latest design and have a few suggestions. Let’s discuss in our next meeting. Best regards, Emily		
